{
  "schemaVersion": 1,
  "product": "CryLoNexus Operator",
  "version": "2.0.0",
  "channel": "stable",
  "network": "CryLoNexus Mainnet",
  "chainId": 5546,
  "protocolVersion": 1,
  "configSchemaVersion": 1,
  "statusSchemaVersion": 1,
  "serviceName": "crylo-nexus-operator.service",
  "minimumElectronVersion": "2.0.0",
  "releasedAt": "2026-07-01T12:00:00Z",
  "releaseNotesUrl": "https://github.com/Heff546/CryLo/releases/tag/v2.0.0",
  "sourceCommit": "aaaaaaaaaaaaaaaaaaaaaaaaaaaaaaaaaaaaaaaa",
  "assets": {
    "linux-amd64": {
      "filename": "crylonexus-operator-linux-amd64-v2.0.0.tar.gz",
      "sha256": "1111111111111111111111111111111111111111111111111111111111111111",
      "sizeBytes": 10485760,
      "downloadUrl": "https://github.com/Heff546/CryLo/releases/download/v2.0.0/crylonexus-operator-linux-amd64-v2.0.0.tar.gz",
      "sbomFilename": "sbom-amd64.spdx.json"
    },
    "linux-arm64": {
      "filename": "crylonexus-operator-linux-arm64-v2.0.0.tar.gz",
      "sha256": "2222222222222222222222222222222222222222222222222222222222222222",
      "sizeBytes": 9961472,
      "downloadUrl": "https://github.com/Heff546/CryLo/releases/download/v2.0.0/crylonexus-operator-linux-arm64-v2.0.0.tar.gz",
      "sbomFilename": "sbom-arm64.spdx.json"
    }
  }
}
